StudentID,StoryID,ClaimNum,NoteTrend,Claim
10375104,10,1,0,Female or Male they go to warm places where temperature go up to 80 degrees. They always go to warmer places
10375104,10,2,1,"Look at 1968, 83.75 degrees, and then look at 2016, 85.57 degrees the temperature goes higher not lower."
10375114,0,1,0,"I think this clam is true, Because in the story it says the Monarch Butterfly's temperature affects how quickly it goes through its life cycle stages."
10375114,0,2,0,"I think this clam is false, Because well I was reading it said that we have to keep estamating the range, Because more Monarch Butterfly's keep coming to the perfecht wether in Mexico to the forest."
10375116,0,1,0,"I think that the temperature effects how quickly it goes threw its life cycle stages partly true/partly false. Because when it is inside it has no place to do its stages and its temperature is to high or low. Also, It is different when its a chrysalis because, whether inside or outside its about the same temperature either way."
10375116,0,2,1,"I think it is false because through the years the population has gone down 100's. For example the population has gone down 876.000 (876 hundredths), from 909.50 to only 33.50. So that is why I think that it is false."
10375123,0,1,1,because if it is could the cocoon is cold then it might freeze and when i am outside in the winter i do not see catpellar's  or butterfly's. In the summer i think it would be much qucker.
10375123,0,2,0,because some butterfly's moved to other places in the world they did not just stay in one place.
10375131,0,1,1,I think the claim is true because outside it is 56.84 degrees  and the butterfly is in the caterpillar stage. The other one says that it is 59.54 degrees and the butterfly in in it's chrysallis stage.
10375131,0,2,1,I think the claim is false because in 1996 the butterfly population is 909.50 million and in 2013 the butterfly population is 33.50 million and there is a big difference in 33.50 million and 909.50 million. So the butterfly population has gone down a lot
10375146,10,1,1,I think this claim is true because all the females numbers are within a couple of numbers of each other. And it is the same for male.\n\nI think this because in the data it says on one piece of evidence that it was 85.82 degress and it was a female then another one said 85.54 and that was a female. \n\nanother reason i think this is because in the data it says 80.56 and it was a male then another one said 80.60 and that was a male to.\n\nin conclusion I think claim 1 is true.\n\n
10375146,10,2,0,I think this claim is false. I think that because it is all around the same number. \n\nI think that because in almost all the numbers are 85 degress  for exsample 17 out of 29 are 85 degress. \n\nAnother reason I think this is because the temperture goes down by like 1 degree and then it goes back up. for example it goes down to 84 degress and then goes back up to 85 degress.\n\nin conclusion i think this claim is false
10375155,0,1,0,I think this claim is partly true partly false because it has to be a certain temperture for a cryselis to form.
10375155,0,2,0,"I think this claim is false because the populatoin has not stayed the same, this is because as the years increase the butterfly number increases to.for example in 1996 there were 33.50 million and fast forward to 2003 there were 556.00 and it just keeps droping and soon there will be no butterflies."
10375160,10,1,1,I think this claim is true because whether sea turtles lay there eggs in the sand and the different temperatures that effect in there eggs shell could change there formation of themselves. To turn into to a male or female. Also I notice that the temperatures stay in the eighties maybe  that also has something to do with it. Males usually in Suriname tend to stat around in under the 85's but females on the other hand stay above an 85 maybe that's a reason the come out male or female.\n
10375160,10,2,0,I think its true because it depends on the weather.And if is hot or cold \n
10375174,0,1,1,Most of the chrysalis temperatures are 60 degrees and over plus maybe the temperatures have something to do with their migration because the text did say that they preffered lukewarm temperature
10375174,0,2,1,The chart clearly shows the population decrease from 909 million to 33 million and maybe it is due to natural causes or something happened  on the way
10375176,10,1,0,"I think it has to do with the turtle population.Because on top of the sand it was warm,But when you dig it gets colder because theirs no sun light but on the other hand when they get layed the ones more to the surface they have more light then others and it shows what is the temperature with is just the right to hatch in my option but the ones with less heat still might hatch that why i think it is partly true/partly false"
10375176,10,2,0,I think that is partly true and partly false because overtime in 1960 the temperature was 84 degrees it did get hotter but it did call down sometime but golble warming witch is making the weather warmer also it goes down and up so i guess it is kind of the same
10375180,10,1,1,I think that this is true because mostly the females are born in hotter sands but all the temputaures are close together which would make me conclude that it would be true. Climate change might over populate the sea turles because if more femals are born in hotter snads that there is going to be a lot more female sea turtles to lay there eggs. This could also impact the population in a different way. That way being there would be not enough males so they could not mate. So that would make the population drop.
10375180,10,2,1,Why I think it is false is pretty simple. If you look at the table or digram then it shows in 1960 the temputare of the sand was 84.56 degrees F. And then go 2014 the temputuare is 86.16 degrees F. So that would lead me to believe that the temputuare of the sand is increasing not decreasing.
10375182,0,1,0,"I think its true because in colder weathers, monarch butterflies usually go inside where it warmer but when  monarch butterflies are in warmer weather they tend to go outside because it would be way warmer than the colder times."
10375182,0,2,0,I think its false because every year its grows to more counts  but in the claim it said the populations stayed the same every year.
10375188,0,1,0,I think that this is partly true because at  first it is a egg and then it goes into the caterpillar for a long time then it will go into the chrysalis then the last thing of its cycle is it goes into the butterfly and then it will go to its place to migrate but the place will not be to clod or it will not be to worm  it will  be just right for the butterfly to live in the winter time.
10375188,0,2,0,"I think this is true because in the winter time when they go to hibernate I think that most of all butterfly""s go to mexico because it is the most right temperature for the butterfly\'s to stay at mexico longer in the winter."
10375190,10,1,0,I think it doesn't mater
10375190,10,2,0,every time in two years the temperature was in between 84-86
14546105,10,1,0,i dont know addy addy addy addy and bestfriends are brynn tyler maddys erin sabree dill pickle sammy myself my sleep peralisis demond
14546105,10,2,0,the article said so
14546112,10,1,0,"The Sea turtles, male or female, are born at a temperature of 80 to 90 degrees F."
14546112,10,2,0,The Heights of sand go up and down through the years\n
14546125,0,1,0,I think it's partly true because it shows that inside they are mostly still chrysalis and outside its more of caterpillars
14546125,0,2,0,This is true because
14546131,10,1,0,vanessa
14546131,10,2,0,vanessa
14546132,10,1,0,The temperature changes the gender because when they are first laid they sea turtles are are not formed. The sea turtles are really undentified
14546132,10,2,0,Because I said so
14546133,0,1,0,ariana
14546133,0,2,0,ariana
14546149,0,1,0,hdjhvjusdnvh
14546149,0,2,0,becues
14546159,10,1,0,"I believe that the temperature can maybe change if it is a male or female, but I don't really know.  Some of the results say record that there were 4 males or females in a row at the same place wich there temperatures would be different in different places, but they also show in some sections that they can be scattered (one female one day a male a different day). But on the other hand, a female lays there eggs all together in the same place under the sand so the temperature would be very close in the same hole and there are different genders in one hole.  So I think that it can be true or false."
14546159,10,2,0,"The temperature has been mostly the same when you look at the data, so obviously, it wouldn't be decreasing over the years."
14546164,10,1,0,i dont know
14546164,10,2,0,i dont know\n
14546176,0,1,0,The temperatures are not that different. They are all in the high 50s/low 60s. The majority is the caterpillar even though the temperatures at least 1 degree apart. But then again a few degrees can make a difference depending on the study.
14546176,0,2,1,"The population went down almost 900 million in only 17 years. The butterfly population went down 13 million in one year. Therefore, the population is going down rapidly!"
14546180,10,1,1,"The graph provided with the investigation shows that commonly the higher temperature sands normally have hatching female turtles unlike hatching male turtles that do their thing in colder sands. Now in the graph, some male turtles hatch in warmer sands than female hatching turtles but not as often as the other way around. I still stick with my decision with true with my reasons conveniently said and the graph for evidence"
14546180,10,2,0,I think the scientists are wrong the sands are not going down in temperature and the graph provides the evidence to support. Yes by the graph the sands go up and down every recorded time like it can go up then it can go down then back up then down but the last one is back up which supports my stupid claim\n
14546182,0,1,0,"Most of the monarchs are still caterpillars because it takes a long time to create a chrysalis,and since it takes long to make a chrysalis it is partly true.But if we did the same but with only chrysalis we will see that its just in the middle."
14546182,0,2,0,Sam
14546188,0,1,0,idk brynn brynn brynn brynn brynn brynn brynn brynn brynn
14546188,0,2,0,idk brynn brynn brynn brynn brynn brynn brynn brynn brynn brynn brynn brynn brynn brynn
14546202,0,1,0,If the monarch butterfly goes through the stages fast then it's probably used to doing something fast and not having the patients to do stuff so that's probably one of it's habit
14546202,0,2,0,no they are not because other monarch butterfly are migrating there.
14546206,0,1,1,"i think that this is partly true because the article said that the weather cant be too cold and cant be to warm. i think this could affect how they grow, if the monarch butterfly are in too warm of weather they could not grow properly. if they are in too clod of weather they could take longer to grow, or even worst die. i do agree that it can cause them to to grow. if monarch butterfly are in to warm or harsh weather it could cause the population to go down in stead of up. that is why i think climate can cause butterfly to not grow."
14546206,0,2,0,"i think this claim is false because, you can see in  1996 there were 909.50 monarch butterfly a year. now in 2013 there are only 33.50 that is a big difference. its because of the weather and global warming. that is why i think that claim is false. i am not saying they are  wrong but i am giving my thoughts and telling them why i think that."
14546207,10,1,1,"In the graph, you can see many of the females were found in Playa and many of the males in Suriname. The temperature for the females is mostly high ranging from 88-84. From this, we can make the claim that females spawn in warmer climates. As the males spawn in cooler areas."
14546207,10,2,0,"As seen in the chart sample one is shown the highest. If you look underneath it you can see sample number 27 and 26. This shows that the climate of the island has not changed very much. Yes, the last test is showed low but most of the other tests show high temperatures."
14546209,0,1,0,the temperature does affect the life cycle of butterflies according to the evidence on the table.
14546209,0,2,1,the population of monarch butterflies has severely gone down from 1996 to 2013
14546221,0,1,0,i think it is true partly true and partly false because if they are in a really cold environment it probably would affect it when it comes out but it is partly not because when they are in the crystallites it can not affect them as much as when they come out
14546221,0,2,0,it is partly true and partly false because it has gone up and done in the different years it has changed over all the years it has gone up and down
14546227,10,1,1,"i believe that the sand can affect the gender some times because in the data that shows has the highest temperatures on top with the lowest on bottom and almost all of the high temps are female rather than male one of the highest temps is 88.08 and is female as well as 87.09, 86.97, 86.54, 86.26, those are the highest temps and they are all female the lowest temperature of the female in this test is 84.20 but most of the males is 83.31, 83.25, 82.45, 82.29, the highest of the males in this test is 85.19 quite low to the female turtles. I did say that this thought was partly true/partly false for these reasons"
14546227,10,2,1,This thought is partly true/partly false because the sand in the 1960's through the 1982's these years had the lowest temps in theses years all the other years above that mostly are higher numbers\n
14546230,10,1,1,because in the hotter temperature the female eggs hatched
14546230,10,2,0,the change in weather can happen
14546246,0,1,0,"I think its wrong because there are similar temperatures and some die as a caterpillar and some die in a chrysalis. for example, there is one where it's 60.90 and it dies as a caterpillar then there's one where its 60.98 and it dies as a chrysalis."
14546246,0,2,0,I think is's false from 1996 the was 909.50 million butterflies going to Mexico compared 2018 with 302.50 million to 2013 with only 33.50
14546250,0,1,0,I believe that the temperature of the monarchs habitats does not depend on the monarchs habitat temperature. The reason that it doesn't depend on the  temperature is because the results vary between inside and outside of the temperature of the chrysalis. One of the temperature for the chrysalis is 59.54 Fahrenheit  and another is 63.14 Fahrenheit that is a 4 degree difference. Also the colder one is outside and  the hotter one is inside. That's why i Believe that the temperature does not matter for a monarch caterpillar to turn into a chrysalis.
14546250,0,2,0,False because on the graph the numbers change depending on the years. because 1996 the butterfly rate was really hi and in 2013 it was really low.
14546256,10,1,0,because the  evidence shows that the temperature is in the 80s so the sand has to be in the 80s to be hatched
14546256,10,2,0,i think this because the temperature is going down and then going right back to the temperature it was at before.
14546260,0,1,1,I think this is fales because most of the higher the tepitures are still in the chrysallis stage
14546260,0,2,0,i think this is false because the evedace shows the number of butter go up\n
14546262,10,1,0,it shows that really no matter what temp it is that any male or female can hatch
14546262,10,2,1,well in 1960 the temp was 84.56 and in 2016 the temp was 85.16 witch is higher but the temp did drop some years but it has clearly gone up
14546263,10,1,0,"I believe this claim is false. I believe it to be false because in the graph you can clearly see there is nearly an equivalent amount of male and female leatherback hatchlings. In addition, they are hatched in the same temperature range of about 80 to 85 Fahrenheit."
14546263,10,2,0,"This claim is false because there is barely a decline in temperature. If you were to say that there is a decline you would need to know it only drops down 1 degree every few years. In the graph, you can see that in 2000,1994, 1992, 1974, 1988, and 1962, it stays 85 degrees Fahrenheit."
14546287,0,1,0,sample #7 is almost the exact same tep as #60
14546287,0,2,0,the numbers ether drop or raise depending on the year
14546289,10,1,0,i dont now
14546289,10,2,0,i dont now
14546293,10,1,0,\nthe sands temperature in the ocean shore affects if  it will be a boy or a girl who will hatch from the   turtles egg.
14546293,10,2,0,"the temperature of  the sand in raine island,Australia has been  decreasing since 1960."
14816104,10,1,0,i think it is false because under the sand the temp is the same even when it is colder abouve ground\n
14816104,10,2,0,i think it is false because the sand cant get colder anly the water can
14816107,0,1,0,i thin that is true becaus that is wat the data said and thats the srcul of life for a buter fliy
14816107,0,2,0,i think thay can not fliy that fast to my grat thay are spostohibrnat in a ckon
14816112,10,1,1,in the lower tempature there are mainly males till 84.20 then it is mixed till 85.42 where the rest are al female
14816112,10,2,0,because in 1960 the tempature was 84.56 in 1994 the tempature was 85.57 as so in 2016
14816114,10,1,1,when it is the warmer climates the eggs are female and when the climates are below 85  they are male
14816114,10,2,1,when you go to the 1960 the temps were 84 and when you go to dates higher up you see the actually increase
14816116,10,1,0,"I think it is false because if an egg is laying playa sand it can come out as a female or male because if you look at the chart and look at what gender is next to playa sand it will say either female or male, not just male, not not just female. Same to do with the Suriname sand."
14816116,10,2,1,"I think it is false because if you look at the temperature in 1960 it is lower than in 2016, so than means that the temperature is not decreasing, that means that the temperature is increasing from 1960 to 2016."
14816119,10,1,1,"The sand temperature affects whether leather-back eggs hatch as male or female because scientific research proves that when the eggs have been laid in warmer sand, the turtle is a female. When the egg is laid in cooler sand, the turtle is a male. Also, These turtles have been laid in different locations. So we know that in Playa the turtles don't tend to be female. That part is totally random. The Male and Female's were both scattered around Playa and Suriname."
14816119,10,2,1,"Some are saying that the temperature of the sand in Raine Island, Australia has been decreasing since 1960. This information is incorrect. As I have made my graph of data that has been collected from the past years, I have found that the temperatures have gone up since 1960, not gone down."
14816133,10,1,0,is all way hot on a iland so they have t o udapt to the heat and there in the sand so the egg are cept cold
14816133,10,2,1,i think it false because of climit chang it get hoter and hoter.
14816142,0,1,0,i think that if the temperature where to change the speed of the butterfly's growth then all the factors in the butterfly's life would change the speed of the butterfly growth and its life cycle i think maybe the winter could make them die so that why they go down to other areas such as Mexico and based on the data it says that the chrysalis was in 63 degree weather and that was the top degrees in this hole graph so that shows that the weather doesn't speed the life cycle of the monarch butterfly's.
14816142,0,2,0,The reason i said it was partly true was because 2006 2005 2007 where about the same but years like 2018 2017 are not the same at all.
14816146,0,1,0,I think this claim is true because if its cold the butterflies are gonna want to be in their Chrysalis. Like when you are cold you wouldn't want to be outside in the cold you want to be raped up in your blanket cause its warmer.
14816146,0,2,1,I think this statement is false because butterflies dies in a quick amount of time they don't stay around for 17 years and the data on the chart has different numbers leading up to 2013 as you can see it has gone down.
14816149,10,1,0,I thinks it is true because a Leather back  can have male or female. some male and female have temper in there body that makes it feel warm or cold.
14816149,10,2,0,"I think it would be partly true and partly false because the temperature of the sand and rain   island , Australia BUT IT THINK IT PROBALEY WOULD BE TRUE"
14816155,0,1,1,I believe that the claim is partly true and partly false because in some parts it shows that maybe the cooler temperatures can change the affects is has on the life cycles but also the temperature is not really changing the affects because there may be a section where a cooler temperature shows that the life cycle is in the caterpillar form then is switches to a chrysalis but it can then switch back to the caterpillar making me believe it is partly true and partly false.
14816155,0,2,0,The number of butterfly have continuously been going up and down each year some dropping my the millions but the number is always changing each year making me say that this claim is false and that the number of butterflies has stayed the same each year. the lowest the butterfly population has been was in 2013 and the most is has been was in 1996 the numbers are way different than this author said.
14816159,0,1,1,I think that it partially matters what temperature it is for a monarch butterfly to effect how fast it's life cycle goes because when i was looking at the data i noticed that if the temperature was over or at 60.48 then it was more likely to be in a chrysalis.
14816159,0,2,0,I think that this claim is false because when i was looking at the data for butterfly population I lined up the years from least to greatest and i started at the year 1993 because that's when scientists started keeping track of the monarch butterfly population and i saw that it kept on climbing up and the population started getting bigger and bigger.
14816176,0,1,0,think that the tempter dose not matter as long as the butter file can survive.
14816176,0,2,0,i think the claim is false because the number of butter flies has changed
14816180,10,1,1,"The sand temperature affects whether leatherback eggs hatch as male or female because looking at the data, males have lower temperatures while the females have more.\n"
14816180,10,2,1,"I think that the temperature in the sand in Raine Island, Australia has NOT been decreasing since 1960, because in our data, the temperature is actually increasing instead of decreasing, for example in 1960, the temperature was 84.5 F, and in 2016, the temperature is up to 85.5."
14816188,0,1,0,because if it is cold the babies will die
14816188,0,2,0,IDK
14816193,0,1,1,When the temperature is higher its seems to male it slower because all of the chrysalis is 59 degrees or above and all of the caterpillars are 60 degrees and under. The chrysalis stage comes first and is all a higher temp than the caterpillars stage is after the chrysalis stage and is a lowe temp.
14816193,0,2,1,In 1996 the count was 909.50 million and just a year after it dropped to 630.50 and all the way up in 2013 the count was 33.50 million so it has dropped about 880 million.
14816201,0,1,0,"The temperatures of a monarch butterfly's can affect the life cycle because for example, the intense heat may interfere with butterfly's natural habitat and life cycle changes and can put heat on monarch butterfly's life cycle by shutting down their organs, or maybe slowing down the process of growing."
14816201,0,2,1,"The monarch butterfly population has decreased by millions. The amount in 1996 909.50, to 2013 33.50. That was a HUGE decrease in population. I should have their job because I even know that."
14816202,10,1,1,why i bileve that tempicher effects weather they are male or female because if you look on the cart most male eggs have lower tepicer and female has higher tempicher that is my reason why
14816202,10,2,0,on the chart it shows that the temperature has decreased and in crested over time making this evidence true
14816204,0,1,0,i picked partly true and parly false because i feel like a butterfly starts asa catterpiller then grows to be a butterfly like other butterflys like ones we have in maine like the ones that come out in the summer and they have to have temperture thats not to hot or cold that is what i think\n\n\n\n\n\n\n\n\n\n\n\n\n\n\n\n\n\n\n\n\n\n\n\n\n\n\n\n\n\n\n\n\n\n\n\n\n\n\n\n\n\n\n\n\n\n\n\n\n\n\n\n\n\n\n\n\n\n\n\n\n\n\n\n\n\n\n\n\n\n\n\n\n\n\n\n\n\n\n\n\n\n\n\n\n\n\n\n\n\n\n\n\n\n\n\n\n\n\n\n\n\n\n\n\n\n\n\n\n\n\n\n\n\n\n\n\n\n\n\n\n\n\n\n\n\n\n\n\n\n\n\n\n\n\n\n\n\n\n\n\n\n\n\n\n\n\n\n\n\n\n\n\n\n\n\n\n\n\n\n\n\n\n\n\n\n\n\n\n\n\n\n\n\n\n\n\n\n\n\n\n\n\n\n\n\n\n\n\n\n\n\n\n\n\n\n\n\n\n\n\n\n\n\n\n\n\n\n\n\n\n\n\n\n\n\n\n\n\n\n\n\n\n\n\n\n\n\n\n\n\n\n\n\n\n\n\n\n\n\n\n\n\n\n\n\n\n\n\n\n\n\n\n\n\n\n\n\n\n\n\n\n\n\n\n\n\n\n\n\n\n\n\n\n\n\n\n\n\n\n\n\n\n\n\n\n\n\n\n\n\n\n\n\n\n\n\n\n\n\n\n\n\n\n\n\n\n\n\n\n\n\n\n\n\n\n\n\n\n\n\n\n\n\n\n\n\n\n\n\n\n\n\n\n\n\n\n\n\n\n\n\n\n\n\n\n\n\n\n\n\n\n\n\n\
14816204,0,2,0,i think it is true because it said people whached the butterfly so i think it is true if they said they whached the butterflyin mexico it has to be in the right temperture not to warm or to cold.\n
14816205,10,1,1,females only hatch above 85 degrees and males hatch at 85 degrees and lower
14816205,10,2,1,in the year 2016 the temperature was higher than in 1960
14816207,0,1,0,i think that the statement was true because a butterfly cant be in the cold for as long as a caterpillar can because of the high winds and over the rain or snow coming down with all the hard pressure.
