StudentID,StoryID,ClaimNum,NoteTrend,Claim
14816207,0,2,1,i think this claim is partly true and false because monarch count has stayed in the millions but the numbers have gone way lower. since 1996
14816209,0,1,0,I think this claim is true because the butterfly can't be in the cold or high winds unlike a caterpillar that stays on the ground.
14816209,0,2,1,I think this claim is partly true and false because the monarch count has stayed in the millions but the numbers have increasingly have gone way lower sense 1996.
14816211,10,1,1,the leather back turtles gender is of the heat the females are mostly hotter than the males. the two that i pointed to were a boy and a girl the girls 5 hotter than the boy
14816211,10,2,1,when i sorter the years i  the new one is the hottest with 85.57 and the last is 84.56
14816239,10,1,0,I think the claim is false because there were similar tempters and it was out of order if it was male or female and in the wild scientists cant control the tempter of the beach so why wouldn't there be more of one type of gender
14816239,10,2,0,all the temperatures are reasonibly close to each other
14816267,10,1,0,i said no because it says on the top temperature 85.80 and its a female and on the 2nd one down is says 85.04 and its a male
14816267,10,2,0,no because it goes from 85.21 to 86.72 also it keeps going from 84 to 85.
14816271,10,1,1,I say yes because it seems that the male are in the low 80s and that the male also and the female are hatching as female in the high 80s
14816271,10,2,1,I say that it is false because the weather is staying at the mid 85-88 and that means it is only getting warmer not colder
18715104,0,1,1,when the caterpiler is in his chrysalis stage it is hoter but when it is in its normal stage it is ushiy less worm [NOTE: grayed out rows already coded in Feb13 file]
18715104,0,2,0,because eavry one of them are diffrent numbers\n
18715107,10,1,0,I really don't know.
18715107,10,2,0,I really don't know
18715116,0,1,0,Because the temperature is higher.
18715116,0,2,0,Because the numbres on the chart.
18715119,0,1,0,I think it's partly true and partly false because there are some caterpillars that have not became a chrysalis in the same temperature as the caterpillars that have already became chrysalis.
18715119,0,2,0,I think it's true because from 1994 to 2006 there has been about ten more or less than the year before and/or the year after that.
18715120,0,1,0,butterfly's like the warmness but it does not help them grow does the warmness help us grow we like it like butterfly's it does not help us grow.
18715120,0,2,0,because more butterfly's have grown sense 1993 so the population has grown and grown sense then
18715133,0,1,1,"the monarch is a caterpillar when it is bellow 59 degrees and its a chrysalis when it is 59 degrees or higher.  But not always, #3 was a caterpillar while it was 59.36 degrees and #29 was still a cater pillar when it was 60.90 degrees."
18715133,0,2,0,"In 1993, when scientists started keeping track, there where 311.50 million Monarchs, but in 2018 there were 302.50 million Monarchs."
18715142,10,1,0,yes because 50 50
18715142,10,2,0,because in the picture it was dawn and some time's its cold at night time
18715149,0,1,0,i think it is true because it said on one that it is a caterpillar and it was 56.84 (F) but then when it was in a chsalar so the wather sangis all the time so the caterpillar is in all cinds of wether.
18715149,0,2,0,because there are no data that the monarch butterfly has stayed in one place for many times in a row. it did not come back in 2013 but they did come back in 2014. so it is false they did not stay in on place for a whily\n
18715155,10,1,0,I think its true because in the important data its says the temperature can change if its a girl or boy
18715155,10,2,0,"I know why it would be true, because Where it says claim two,  it says that its decreasing."
18715159,10,1,0,?
18715159,10,2,0,?
18715176,10,1,0,it shows that the higher temperature always gets female and every low temperature would be male
18715176,10,2,0,in many years there's proof of temperature rising an decreasing back and forth.
18715180,0,1,0,Because you have to know the butterfly's temperature if you are going to learn about them\n
18715180,0,2,0,Because mexico can not stay the same it haves to change at some point that's what I think.
18715188,10,1,0,because when my uncle was in the coast gaured  had to practice scuba diving and when he did did they broat like a almost 100 year old turtle in i think i said i think to do somethng with it he never told me what he did with the turtle
18715188,10,2,0,because i was watching a lazar beam vid and he said tutles are mostly laying eggs in kindoff middil tempature  but i belive hed tell us if they were laying eggs in warm wether or cold wether
18715201,10,1,1,Because some male temps are low that means that females are high temps. But some males are quite high in temps.
18715201,10,2,0,The graph shows that the temps of the sand have decrease but in some years they got higher.
18715202,0,1,0,I think this is true because if it is super cold outside the butter fly will be very cold and might freeze to death.  But if it is to hot the butter fly might die of heat.
18715202,0,2,0,The answer to the question is false.  It is false because the information I am getting says that it has gone up a lot more.
18715205,0,1,1,because some are a high temperature and the monarchs are still caterpillars but some of the low temperatures are chrysalises
18715205,0,2,1,because the butterfly count goes down a lot ever 1 to 2 years
18715206,10,1,1,I think its true because if you look at the data on the chart you can see that male turtles are hatched when the sand temperature is 85.04 and below and the females temperature is  is 85.04 and higher.
18715206,10,2,1,"It has not decreased since 1960 it accutally risen a little bit. Because, if you look on the chart 1960 the temperature was 84.56 put then in about ten years it droped down a little bit but then rose back up, In 2002 the temperature was 86.72. It has risen 1.26 in the temperature."
18715211,0,1,0,I dont know
18715211,0,2,0,i dont know
18715214,10,1,1,"True, because if the sand is cool then it is a male, but if the sand is hot then it is a female."
18715214,10,2,0,"Yes, because if you look at the temperature it is going down and down more."
18715239,0,1,0,they wod be dead of the temprchor.\n
18715239,0,2,0,becase mecsco is a relhy wome stat. they wodnot be daed.
18715259,10,1,0,I think this claim is true because in Playa the temperature is 85.80 and the turtle is a Female and in Playa the temperature is 80.67 and the turtle is a Male.
18715259,10,2,0,I think this is false because in 1960 the temperature was 84.56 and the the temperature in 1962 was 85.10 so its been going up not down.
18715267,0,1,0,i dont know
18715267,0,2,0,I dont know\n
18715293,10,1,0,BECASE IM HOMEAFOBIC AND I HATE TRANSEGENDER
18715293,10,2,0,this is boring
18715322,10,1,1,The females are usually hotter.
18715322,10,2,0,It has not been decreasing because it got higher.
18715324,0,1,0,because some times its colder than other times and its still the same part of the cycle\n
18715324,0,2,1,because its going down evrey year
18715326,10,1,0,Most eggs don't hatch with warm weather but they also can hatch themselves.\n
18715326,10,2,0,The reason why I think it is false is because it can't be true.\n
18715337,0,1,0,"because it starts from caterpillar to chrysalis, then it ends with a caterpillar not a butterfly."
18715337,0,2,0,because it went from 33.50 to 909.50.
18715341,10,1,0,Because when it's a girl the temperature is in the 80's and when its a boy the temperature is in the 80's too.
18715341,10,2,0,Since 1960 the temperature has bean in the 80's but it has bean going down but not by much at all
18715352,0,1,0,i think  it is false because they don't rush right throw  there life sycel
18715352,0,2,0,because they go to mexico in winter
18715354,10,1,1,In Playa most of the females sand temperature is higher than the males sand temperature. Like number 1 Playa 85.80 was a female. then number 8 at Playa 80.67 was a male. So it must make a difference if the temperature of the sand is high or low because almost all of the lower ones are male and most of the higher ones are female.
18715354,10,2,1,In 1960 the sand temperature was 84.56 and in 2016 the sand temperature was 85.57. So clearly it has not been decreasing it has actually been increasing.
18715383,10,1,0,latherback sea turtles are the bigest species. and they can get up to 2000 pounds but the green sea turtle can get up to 500 pounds an live up to 100 years old
18715383,10,2,0,it is very important to know understand protect these beautiful  animals
18715391,0,1,0,i don't know you tell me
18715391,0,2,0,if anyting there over popualated
24465101,0,1,1,"All higher temperatures above 59.50 are in stage 3 or 4 because of how high the temperature is in there location. But just 6 of them are still in stage 2 though.I have thought about it and came up with this theory, they may have been born just went the temperature was warmer and they still are growing fast but just have not made the cut."
24465101,0,2,0,It is true because from 1993 to 2018 it has stayed very close .The count is off by 9.00 million monarch butterflies.
24465106,10,1,1,I can see that the Female has bigger numbers then the Males
24465106,10,2,0,I think its False because its not the first one to be the lowest number
24465107,0,1,0,becuse i feel like it is true and
24465107,0,2,0,becase\n
24465121,0,1,1,"The claim is false because I sorted it lowest to highest temperature and the caterpillars was yes, all in one group, but they kept going back 'n' forth. Caterpillars, chrysalis, then back to caterpillars. \nSo therefor the caterpillars will form into pupa at different rates in different temperature, however, it changes groups in the same temperature!\nFor instance, 59.36 is in the caterpillar bunch, but, the pupa is in 59.54.So maybe temperatures could support faster growth, however, due to the continuous changing i believe that this statement is also incorrect. That is why the statement is partly true, and partly false.\n"
24465121,0,2,0,"I think that this is incorrect information because it states ""...the monarch butterfly population in mexico has stayed about the same.""\nHowever, as you see in my graph, through the years the population has gone anywhere from a bit less than 100 million to 900 million!\nDue to they scattering of the population I believe that in the past recorded years the population hasn\'t decreased, or increased. It has went back and forth, meaning that it is not only healthy, but that it is going on a natural in predicable course.\nSo, in conclusion, claim #2 is completely incorrect."
24465153,10,1,0,I think it is true because a turtle needs to feel comfortable when they are laying their eggs.
24465153,10,2,1,In 1960 the temperature was 84.56 and the temperature kept getting higher not decreasing.\n
24465156,10,1,0,sometimes it might be harder to lay eggs and give birth in colder-weather because it might hurt
24465156,10,2,0,it might of been decreasing because of the weather
24465163,10,1,0,Cause the type of turtles only hatch as males
24465163,10,2,0,It goes down and goes up\n
24465171,0,1,0,I think it is because if its cold the butterfly might freeze and if they are warm they will have a longer lifespan and they migrate so if the to some place warm and the tempature changes they might die
24465171,0,2,0,I think the numbers change depending like how much food they\neat or the tempature or the breeding.
24465178,10,1,1,84.20 and up is allmost all female
24465178,10,2,1,if anything the temperature has bean going up in stead of down because if you look is gose from 84.56 all the way to 85.57\n
24465189,0,1,1,"Every chrysalis tested had a temperature between 59 degrees and 63 degrees. The majority of  the chrysalises were inside.\nEvery caterpillar tested was between 54 and 60 degrees. Most caterpillars were outside. the locations for both were very close between more inside or more outside. Overall, I think it is partially true is because it is true, but the difference in temperature ranges was very small and might not mean anything. Also, the location may or may not have made a difference."
24465189,0,2,1,The count overall got smaller.
24465201,0,1,1,if it is warm out it will change faster than if it is cold
24465201,0,2,0,it will stay the same because it is warm\n all year around
24465203,10,1,1,"The temperature for male eggs was between 80-86, which is lower than the 84-87 that the female eggs had. I believe that if the egg is warmer, females will hatch. If it's colder, males will hatch."
24465203,10,2,0,"The temperature seems to go up and down each year. It isn't exactly decreasing, but it does go down a tiny bit each year. But then it will rise again, being back to the temperature it was before. I believe it's partly true, but the temperature rises again in a few years,"
24465214,0,1,0,i'm not good with math\n
24465214,0,2,0,this is why i think that the answer is true because up in the right corner  it says that in mexico the population stayed about the same.
24465223,0,1,0,because if the temperature change  will efeck\nit and it will not think it is clam.
24465223,0,2,0,in mexioco the count of marnark buttr flys stay the same because it is always worm there\n
24465231,0,1,1,"For the first 2 data reports, both ""butterflies"" were outside. 2\'s butterfly was outside in warmer weather, and was a chrysalis already. 1\'s butterfly\'s was in a cooler weather than 2 so warmer weather does speed up the life cycle of a butterfly."
24465231,0,2,1,"As you can see in the data...over the years the butterfly population in Mexico has changed. There were way more butterflies in the 90's. in the 2000's the numbers died down , but in the early and late 2010's it slowly started rising again."
24465255,0,1,0,I think That It's Partly true And Partly False Because When You Look At the chart it Kinda Changes The form By tempature But it Kinda Doesn't.
24465255,0,2,1,Because when You Look At Them It starts at 909.50 and goes all the way down to 33.50. So It Dropped Very Low When through the years.
24465260,10,1,1,I think this is true because if you look at the temperatures \n84 degrees and up are all females and if you look at the male temperatures they are all 86 and under.
24465260,10,2,1,If you look at the years under the year 2000 they have all smaller temperatures than the sand in the 2000's. So that means that the temperature increased actually.
24465276,10,1,0,As you can see the claim is false one of the female leatherbacks are 82.45 and it was at suriname and a difrent leatherback was 86.97 and it was at suriname so it is false
24465276,10,2,0,as you see the years to 1960 to 2016 the 1960 is at 84.56\nbut the 2016 is at 85.57 so it is false\n
24465293,10,1,0,i think that because they can both be man or femal
24465293,10,2,0,because the heat goes upbut it also goes low\n
25416110,0,1,0,"The data shows the caterpillars are turning into chrysalis at certain temperatures without supplying anymore info. How much did they eat? What did they eat? Where did they live? When did they eat? Were they sick? There's a lot more that we would need to know in order to tell. There are indoor caterpillars that turned in to chrysalis, but outdoor caterpillars, too. For all we know, the outdoor ones could be more productive out in the wild, and the indoor ones may just be fed and lazy."
25416110,0,2,0,"In 2013, the population was 33.50 million, but in 1998, it was almost 30 times that! Not much more to say."
25416116,0,1,0,"I think its partly true and partly false Because, it depends where they are like if there  Africa i could be jest right or too hot or in Maine it could be to cold that's why they go away for the winter. They go the warmer climits when there climit is too cold. That's why I think its partly true and partly false."
25416116,0,2,1,"I think false because, They been going down in the last few years. Also when it gose down also the year is too so this shows something to do with us! Thats why I think its False."
25416119,0,1,0,The reason why is because heat can change how will it gose thought it's cycle because it can shevle up and it could die in the cold due to the tempture drop.
25416119,0,2,0,i think that it is parlty true and partly false. i think this because even though it is about the same  dosen't mean that it did not drop before.
25416120,0,1,0,the temperature does not seem to affect the butterfly's life cycle.
25416120,0,2,1,its not the same. the population has jumped around but has gotten smaller. it slowly gets smaller.
25416124,10,1,1,I think it is true because in the data the lower temperature the more males and the higher temperature the more females.
25416124,10,2,0,it has been decreasing but not very fast.
25416144,0,1,1,"If you look at the temperatures from lowest to highest, you see that all the lowest temperatures say caterpillar and the higher temperatures say chrysalis. This shows that the temperature of the habitat affects how quickly monarch butterfly's life cycle stages change."
25416144,0,2,0,"In my graph, the dots representing the number of butterflies are scattered all over the place, definitely not the same. This proves that the claim is false."
25416146,10,1,0,I don't think that the temperature affects there gender because they were already made in the costumier of the turtle. So if I was in my moms costumier and it was hot I don't think that would affect my gender. But this is a hole different animal. But its not able to switch its gender.\nA mom cant just say i want a girl. that's not possible.
25416146,10,2,1,there has been forest fires in Australia. its been alot hotter there since before the fire
25416147,10,1,1,"Most of the male eggs are hatched in cooler weather, however most of the female eggs are in a little bit warmer weather"
25416147,10,2,0,The weather is not going down. I know that because in 2002 it was just about the same tempature as it was in 2012.
25416149,0,1,0,i think it is true because if there cocoon is frozen then they can't be changing and there stages of becoming a butterfly.That's why i think the temperature matters in a butterfly's habitat.
25416149,0,2,1,i think it's false because it says they started tracking in 1993 and from 1993 to 2013 the population has gone down instead of staying the same it went from 909 million to 33 million.This is why i think that the monarch butterfly's population didn't stay the same.
25416155,10,1,0,it does not madder about the weather. It just madders what the turtle gave birth to in the eggs.
25416155,10,2,0,It could be because of rain and the temp in the air around the sand that makes the sand colder. its defiantly going down.
25416156,10,1,1,Lots of the turtles that were raised in a cooler environment were males. A piece of evidence is from 80.60 to 83.85 are all males. The females are manly in the group with higher temperature. For example from 85.42 to 88.08 are all females.
25416156,10,2,1,I think the claim is false because in 1960 the temperature was 84.66 on Raine island. Over 58 years it has increased and decreased but in 2018 it has gone up to 85.67.
25416180,0,1,0,Becuase if its cold the monarch will die becuse it does not have much fat on it so if will freeze to death
25416180,0,2,0,Because more and more butterflies come there each year.
25416186,10,1,0,"if you look at 1,2,and 3 the first is female and the temperature is at 85.80 and then the second one is male the temperature for that one is 85.04 but if you look at the third its female but the temperature is 84.77 which is colder than the males"
25416186,10,2,0,if you look at sample 6 in 1962 the temperature is at 85.10 but then if you look at sample 27 in 2014 its at 88.18
25416201,10,1,1,"I think it is partly true and partly false because most of the sand that was 85 or higher were females, and most of the sand that 85 or lower were males. It isn't like this through the whole thing."
25416201,10,2,1,"I think this claim is false because if you look at the evidence you see that it has barely going up, and it has stayed in the 80's for most of the years."
25416204,10,1,0,because the male turtles have to stay safe and if we are being honest i don't remember the question
25416204,10,2,0,This is hipping because of the forest fires and polotchipon\nthat has been happening for years
25416205,0,1,0,"sometimes it did turn into a chrysalis, and sometimes it didn't. Iv'e heard that it depends how much food it has."
25416205,0,2,0,The number (in millions) goes up every year. that is NOT staying at around the same number.
25416207,10,1,1,"If your looking at the chart, the females temperature is much higher than the males but, some of the temperatures are the same for both the genders. Thats why I think its partly true."
25416207,10,2,0,"If your looking at the chart, all the temperatures are around 83,85, and 84. Which means they haven't been decreasing at all."
25416211,0,1,1,"when it was cold outside they were mostly still caterpillars. I also saw that some of them were inside witch I think has effected how they grew to be butterflies because it was warmer inside then outside some days,  I think that may of effected how they grew."
25416211,0,2,0,When the years went by the monarch butter flies population goes up little by little. so that means the population did not stay the same.
25416214,10,1,1,"When you sort the data from low to high,you can clearly see that the claim is partly true. On the lower side of the chart, it is only male but in the middle some of the temps. Run up to 85.19 dagress. Which was uncommen for the sex. Wich is why only part of the claim is true."
25416214,10,2,1,"In the data if we take the oldest date and the newest date, we will see that the water is accutaully is incressing."
25416231,0,1,1,because when in the higher temperatures the insect is mostly in the caterpillar stage and when it's in the lower temp they're mostly in the chrysalis stage but in some parts of the table that is not true.
25416231,0,2,1,every year since 1996 the monarch butterfly population has gone down every time a new year comes so the butterfly population cannot be the same if in 1996 909.50 million butterflies and the in 2013 there are only 33.50 million they have gone down by about 878 million
25416288,10,1,0,Sea turtles are kinda the same as people. When they are born the heat doesn't change the gender. For ex: Sample number 3 and 16 They both have 84 as there temperature but one is female and one is male. It depends on if the father gave that egg the X or Y in the chromosomes.
25416288,10,2,1,In 1962 the temperature was at 85.10 degrees. and you keep going up in years the temperature goes up and down depending on the weather. In 2008 the temperature was at 85.21. That is a increase if anything in the temperature. it was a 0.11 increase in heat.
25416293,10,1,0,I think this is false because they are all different temperatures and one of the males temperature is 84.98 and a females is 84.20 so those are almost the same temperature so it does not matter.
25416293,10,2,0,I think it is not changing because they are all different and all over the place with the temperature\n
25416310,0,1,1,The temperature of the monarch butterfly's habitat can kind of affect how fast they change if the conditions are to hot they might form faster than if the conditions were cooler. the butterfly's can sometimes be in the sand and if they are lower in the sand they wont get as hot but  the higher up they are in the sand the hotter they will get and might form faster. if they are i sand they can change all kinds of speeds but it can all depends on where they are in the sand.
25416310,0,2,1,The scientists are saying that the butterfly's population is staying the same but from 1996 to 2013 they have lost loads of butterfly's and the scientists are saying that the butterfly's population in Mexico is staying about the same.
25416312,10,1,1,I said what I said because of males where more cornily born in colder places
25416312,10,2,0,because of their ar fewer turtles
25416318,0,1,0,"because if its to cold it might freeze, killing the butterfly, and if its to warm or hot it could die of exhaustion or it could over-heat causing the stages of a butterfly to slow down."
25416318,0,2,0,because over the years the count of butterfly's in mexico had increased and decreased alot
25416320,0,1,0,I think its false because if stage 3 froze than i will take more time to unfreeze.
25416320,0,2,0,I think is true its because the monarch butterflies like it warn in Mexico.
25416321,10,1,0,The temperature of the sand shouldn't affect the eggs because when you look at your data table you can see there is no clear pattern for the temperatures to prove that there is a way for the temperature to affect whether leatherback eggs are hatch as male or female.
25416321,10,2,0,I think this is true because the data table shows that the temperature was decreasing lower and lower each time they tested it.
25416324,10,1,1,higher the tempeature the more females hatched
25416324,10,2,0,the temperature is always within 2 degrees\n
25416330,10,1,0,i think its true because the temperature affects whether leatherback eggs hack then they will die
25416330,10,2,0,i think true because in australia they have rain and sun some times and i think that would affect them in australia
