StudentID,StoryID,ClaimNum,NoteTrend,Claim
75336147,0,2,0,If it stayed about the same it would have been in the 30s but now it went from thirty three to 56.50 within a year.
75336150,0,1,0,if the caterpillar is in the cold weather wean it is in a chrysalis it would slow it down the save its energy.
75336150,0,2,1,the butterfly population has gone down in 1996 it was at 909.50 in. 2013 it is at 33.50.
75336155,0,1,1,as the temprature ranged from 57-62 the catarrpillars turned into stage 3 crysiless depending on the location this could be caused by humidity outside or inside but as it got warmer they changed mostly on the warmer side inside and a little cooler outside again probably from humidity
75336155,0,2,1,as the years go by they get lesser and lesser from 909 million to 33 million
75336156,0,1,0,It was warm and it grew and it was cold and it grew the same time.
75336156,0,2,0,in 2013 there were 33.50 million and in 1996 there was 909.50 million and that is an 876 million difference.
75336167,10,1,1,because most of the time there are male and female sometimes there are just female and sometimes the a just males because male need to be colder to the ground or the won't be a male they will then be a female. female need to be warmer than the males if there to cold they will most likely to be a male
75336167,10,2,0,"because all the year I saw were all different yes. but, one of the things it showed that in 2002 86.72 for the heat in ('F). it shows that in 1994 in was 85.57  for the heat in ('F."
75336170,10,1,0,i think its false because it said that they hatch in the sand and go find safety in the sea they don't  say anything about having a special temature.
75336170,10,2,0,i think its true because it said in the subtitle that this was true.
75336173,0,1,1,because at temperatures higher than 60 the caterpiller would be in a chrysalis and any lower it was still a caterpiller.
75336173,0,2,1,"the butterfly population has dropped at increasing speeds instead of staying the same, the evidence is in 1996 the butterfly population was 909.50 million and in 2013 it is at 33.50 million."
75336174,10,1,0,it keeps the eggs warm\n
75336174,10,2,0,because ofclimat change
75336180,10,1,0,maybe it is because of  partly true/ partly False
75336180,10,2,1,yes because of its tempura is raising.
75336181,10,1,1,sometimes the female leatherbacks are born around 84 degrees to 87 degrees.\n
75336181,10,2,1,The temupature since 1860 has been going up until 2000s and started to go down and up.
75336182,0,1,0,I think it is not eftine becaues it do not say that it is
75336182,0,2,0,becaues it not chaging\n
75336186,0,1,0,"Usually, a caterpillar needs its time to hatch into a butterfly. That's why\nthey try to find the best place in a warm and slightly cold place like California and Mexico. If you don't know. On Day 11 the Chrysalis did not hatch faster or slower. It usually stays outside more than inside"
75336186,0,2,1,"When you look at the chart pay attention to the numbers of the population. It was going downward! In 1993 the population was 3 million to 1996, 9 million now look at 2013, 33 million! It was in the hundred million not 10 million! You can not say it has stayed the same when it fell down to 10 million. I think the claim is False!"
75336188,0,1,0,"I think it is true because different habitats can have an effect on stuff like the food there. not the right food can affect its life stages life, for example, it could be late on becoming a butterfly or like it could be a caterpillar for longer than it should"
75336188,0,2,0,because each year more go to Mexico because it's warm in Mexico.
75336189,10,1,0,"It says the sand temperature affects whether leatherback eggs hatch as male or female, but scientists figure out when they hatched."
75336189,10,2,0,"At 1998 first to number is getting lower just like what the claim #2 have say about that Raine Island, Australia, has been decreasing since 1960. but then the rest is the increasing then decreasing. I might actually not really know what their meanings are."
75336190,10,1,0,because it said it in the reading
75336190,10,2,0,because it was in the reading!!!!!
75336191,0,1,1,I think its partly true/ partly false because in some parts it's colder than the warm temperature and it still said chrysalis.
75336191,0,2,0,I think this because some years there very little and some years there was a lot.
75336197,0,1,0,I think that the temperature efaces the cycle cus of the  temp difference of the caterpillar and the chrysalis
75336197,0,2,0,jlb
75925101,0,1,0,"All of the facts that were included in this text had great details. I think temperature does effect how fast the monarchs go through their life cycle. I think this because if they get to cold when they are in their chrysalis they can freeze on the inside and not grow. Also, if it is too hot for the caterpillar in it's chrysalis it would probably kill them and cause them to not grow anymore."
75925101,0,2,0,I think this claim is partly true because mostly a lot of females make it to Mexico to lay eggs when they hatch the females die. That wouldn't make the population of butterflies be exactly the same. The females lay several eggs witch would make more not the same. It is almost rare for butterflies to make it back from Mexico because of the weather or they die in Mexico.
75925101,11,1,0,Partly false because I assorted the data table by temperature and some temperatures were the same but they had a different gender. Partly true because from 80-84 they were mostly only male turtles and just a few female turtles. Through 85-88 there was only female turtles.
75925101,11,2,0,I think false because I assorted the data table by lowest to highest year and from 1960-2016 the range in temperature stayed within  83-86 it could not be decreasing.
75925102,1,1,1,After 11 days there were more chrysalises when it was warmer and more caterpillars as it got colder. So warmer temps make the monarch butterfly's life cycle go faster.
75925102,1,2,1,The dots on my graph  are all over the place. It goes by the year and count by millions. Some dots are near the bottom and some are near the top. In my chart the numbers range from 33.50 million to 909.50.
75925102,10,1,1,I think the sand temperature affects whether leatherback eggs hatch as a male or a female. I think that because on the data the warmest sand had mostly females and the cooler the sand got the more males there was. The warmest sand a male was hatched in was 85.19. The coolest a female egg hatched was 84.20. That is why sand temperature affects whether leatherback eggs are female or male.
75925102,10,2,1,The highest temperature was in 2002. The lowest temperature was in 1968. On my graph the temperature was going up and down not just a line going down. If anything the temperature is going up for 1960.
75925106,0,1,0,most shows that the tep is difrent but they still grow the samw
75925106,0,2,0,it has mostly changed
75925106,11,1,0,I think that the  sand tempechure WONT change wether  a sea tuttle haches a boy or girl. Becauls i looked at the data tabelle and saw that mostly  regardles of the  temechure ita an even chance.
75925106,11,2,0,I looked  at the smallest tempshore and it is 2002 Wich i found helpfullbeculs  IT means it is NOT decreasing if 1960 is only 8456
75925112,1,1,0,I think sand temperature affects leatherbacks so they hatch as male or female. Temperature from as low as 84.20 to as hi as 88.08. Males are as low as 80.60 and as hi as 85.19.
75925112,1,2,0,it is not true in 1960 the temperature was 84.56 and in 2016 it was 85.57.
75925112,11,1,0,I think sand temperature affects leatherbacks so they hatch as male or female. Temperature from as low as 84.20 to as hi as 88.08. Males are as low as 80.60 and as hi as 85.19.
75925112,11,2,0,it is not true in 1960 the temperature was 84.56 and in 2016 it was 85.57.
75925114,0,1,0,"I think it's true because, I think that when it's hot the chrysalis is more likly to be wanting to get out of the chrysalis. The butter fly could also be wanting to dry it's wings on the sun ( because it's hot.)"
75925114,0,2,0,"I think this claim is false because, when you look at the graph, the count is not the same, in the years. In 1997, this is the most of the butter flys had been there.(in Mexico.)"
75925114,11,1,0,"If you put the temperature from lowest to highest and look at the male/  female collem, the low temperature is female, and the male is in the high temperature."
75925114,11,2,0,"When we look at the  year, then at the temperature, we can see that in 1960 the temperature was high, but it said that the temperature in Raine Island was decreasing, which means that it was going down."
75925123,0,1,0,I think the temperature affects the monarch butterfly because when i changed the temperature to highest to lowest i saw that in the 60s i saw that they were all mostly chrysalis and when the the temperature is lower they are caterpiler.
75925123,0,2,0,that is not true because some numbers were is the 900s and some were only in the 100s so it was all mixed up so i would not say it was about the same.
75925123,1,1,0,I think the temperature affects the monarch butterfly because when i changed the temperature to highest to lowest i saw that in the 60s i saw that they were all mostly chrysalis and when the the temperature is lower they are caterpiler.
75925123,1,2,0,that is not true because some numbers were is the 900s and some were only in the 100s so it was all mixed up so i would not say it was about the same.
75925131,0,1,0,some of the chrysalis are at the 56 degree mark but most of them are from 60 to
75925131,0,2,0,on my graph is doesn't look like the population is the same because it keeps going up and down not a steady amount each year
75925131,1,1,0,some of the chrysalis are at the 56 degree mark but most of them are from 60 to
75925131,1,2,0,on my graph is doesn't look like the population is the same because it keeps going up and down not a steady amount each year
75925133,1,1,0,some caterpiller's and chrysalis live in the same location and some are growing faster than others
75925133,1,2,1,because it is not staying the same actully it is getting lower
75925133,10,1,0,I looked at the chart and saw a female and male turtle that live in different places but same temputure
75925133,10,2,1,In 1968 the temperature was 83.75 and in 2002 the temperature was 86.72 so it was going higher
75925139,1,1,1,I think the claim is true because the graph shows that the highest temperature shows that the catupiler is in its chrysalis the coldest temperature the butterfly was still a catipiller.
75925139,1,2,0,in 2018 there was 302 and in 1995 there where 630 and in 1996 there was 909 and in 2013 there was 33 so I think that that claim is false.
75925139,10,1,1,"the males are at the bottom and some in the middle, the females are at the top there are three in the middle. Also it said in the beginning that the temperature determines if they are male or female."
75925139,10,2,0,in 1960 it was 84.56 (f) then in 2016 it was 85.57 (f). that is why.
75925142,10,1,1,"When I was looking at the evidince, I noticed that all of the males were in sand of the temperature 85.19, and lower. all of the females were born at the temperature of 84.20 and higher. So to conclude the males are born at colder temperatures, and the females were born at slightly warmer temperatures."
75925142,10,2,0,"The claim is that temperature of the the sand in Raine has been decreasing since 1960. I think that it is sort of true, because the highest the highest temp. that the sand reached was 86.72. that was in 2002. the lowest temp. that the sand reached was 83.75, that was in 1968. so the sand has been getting to temps. in between both those numbers."
75925149,0,1,1,I found that the butterflies grow more in warmer weather.   The butterflies in 54 degrees were still in the caterpillar stage.  But in the 62 degree range they were in the chrysalis stage.  That shows they grew more.
75925149,0,2,0,I think this is false because the count goes from like 90 to 400 to 30.  On the graph it goes from 50 to 200 to 900.  900 is the most.  If it stayed the same most of the data would be in a line.
75925149,11,1,1,The data shows that in higher temperatures females are normally hatched.  In lower temperatures male are normally hatched.
75925149,11,2,0,The temperature has been increasing not decreasing. The graph helps me see that.
75925155,0,1,0,sample ones temp is 56.84 and is a catapiller.sample twos temp is 59.54 and is a christallis.
75925155,0,2,0,Sample one has 33.50 million buterflies.Sample number 8 has 145.50. The numbers go higher every sample number.
75925155,1,1,0,sample ones temp is 56.84 and is a catapiller.sample twos temp is 59.54 and is a christallis.
75925155,1,2,0,Sample one has 33.50 million buterflies.Sample number 8 has 145.50. The numbers go higher every sample number.
75925159,0,1,1,I know the temperature of the monarch butterfly's habitat affects how quickly it goes through its life cycle stages is because when I sort the data by cold to hot and most of the hot temperature was the chrysalis meaning they do better in hot places
75925159,0,2,0,"the monarch population staying the same is false because looking at my data, the numbers are nowhere near eachother"
75925159,11,1,1,I think this is false because the temperatures are around the same number in the 80's.
75925159,11,2,0,"This answer is false because looking at the temperature range, it's staying in the same range from 1960 and up.\n"
75925167,1,1,1,I am seeing that the life cycle IS affected by the temp. of their habitat.\nSome evidence that my claim is true is that 60 Degrees *f is when they start turning in to caterpillers but over 60 is chryalises.
75925167,1,2,0,Looking at my data I desided that I would make it into a graph. \nThen I set the Y axis to sample number and X axis to year then I added a trend line and saw the data going down hugely. It went from 909.50 to 33.50.
75925167,10,1,1,One reason why I think that is partly true partly false is if that were true then either 1 or 25 would NOT be the same gender as they are because number 1 (85.80) is only .61 hotter than 25 (85.19). I think it is partly true to because the the data shows Females average 85 and a half maybe more and also shows the Males average 84 and a half so that is why I think that it is partly true and partly false.
75925167,10,2,0,because in the 1990s there was maybe half 84 and half 85 but in the 2000s it is  more 84 than 85 I sorted it by year so I could see the difrence between years in order I just checked if it was not just the 2000s they were talking about but it did not matter.
75925171,1,1,0,so on my chart i changed it to temp and it shows the colder it is the more likely to become a Caterpillar faster then the hotter places in the hotter places they are still in there chrysalis so it does affect how fast it goes through the life cycle and if i were a butterfly i would want to live in a colder place because i'm impatient.
75925171,1,2,0,well back when they first started keeping track it was the highest number and it was still really high then it was all over the place so it wasn't the same or it would have roughly the same numbers by years but they are just all over the place so i think they are wrong.
75925171,10,1,0,the importent info sayes the tempecher efects the gender.  its right because with my evedence it effects the turtles by gender.it also sayes that the temp efects the turtules in the story.\n\n\n\n\n\n\n\n\n\n\n\n\n\n\n\n\n\n\n\n\n\n\n\n\n\n\n\n\n\n\n\n\n\n\n\n\n\n\n\n\n\n\n\n\n\n\n\n\n\n\n\n\n\n\n\n\n\n\n\n\n\n\n\n\n\n\n\n\n\n\n\n\n\n\n\n\n\n\n\n\n\n\n\n\n\n\n\n\n\n\n\n\n\n\n\n\n\n\n\n\n\n\n\n\n\n\n\n\n\n\n\n\n\n\n\n\n\n\ns
75925171,10,2,0,astralias nesting area is the most importent nesting area so it cant be decresing
75925174,1,1,1,I think this claim is false because if you see on the data when monarch butterfly's  are inside they can be a caterpillar or a chrysalis. But on the outside it shows that it can be the same as the indoor. Also as you can see lower temperatures and higher temperatures can both be caterpillars or chrysalis's. So I don't believe the temperature affects them or the habitat.
75925174,1,2,1,I think this claim is false because as the years go on the temperatures are not staying about the same. Sometimes one year is millions more than the other. Through out the year it has gone up and down with less millions and more millions. So I believe this claim is false.
75925174,10,1,1,I think this claim is partly true and partly false. I think this because if you look at the males most of them have lower temperatures than the females. Most males are 85 to 80 for their temperatures. As you see most females are 85 and up. But some males are higher than 85 and some females are lower than 85. But as you see most females are higher than 85 and most males are lower than 85.
75925174,10,2,1,I think this claim is false because at 1960 it was 84.56. But if you look at my evidence two years after it was 85.10. Through the years the temperature has been getting higher and is not decreasing. Also the temperature got up to 86.72 which has not decreased from 1960. So the temperature of the sand in Raine Island is not decreasing.
75925180,1,1,1,"Well, when I sorted the data by temperature lowest to highest, I looked at the life cycle stages and first there were a chunk of caterpillar  and then chrysalis  then more caterpillars back and fourth. I think that if the claim was true then all the caterpillars would be together and all the chrysalis would be together."
75925180,1,2,0,"I put every year in order and then looked at the count (millions). Then, I realized that there were numbers of all different places. Some were higher and some were lower. For example, in 2009, the amount was 96.00 and in 1996, the monarch count was 909.50."
75925180,10,1,1,The highest temparatures of sand are normally when females are born. The lowest tempatures are mostly male.
75925180,10,2,0,"I think that because the temperature goes higher and lower at all different years. For example, in 1960 the temperature of the sand was 84.56 and in 1962 the temperature was 85.10 which is higher then before."
75925182,0,1,1,the weather makes the monarch slow done if it is to cold out they stay as caterpillars and when it is hot they grow up faster.\n They grow faster if they eat more.\nthey grow slow if it is 61 to 54 farinhite\nmost of theyse are still caterpillars because it is still cold
75925182,0,2,0,In 1996 there were 909.50 mil butterflies. But in 2013 there were 33.50 mill and that is not a lot.
75925188,10,1,1,I see that the males mostly hatch in a little colder sand. I also see that the females are mostly born in sand that is a little bit warmer then the males. I think that the fact is partly true because that is not true for some of the turtles.
75925188,10,2,1,I think this statement is false because I put the temperature in a graph and it seemed to be incresing.
75925190,10,1,1,I think it is partly true party false. If you look at the claim it is (the sand temperature affects weather leatherback eggs hatch as male or female.) Then look at the chart male temperature is from 85.19 to 80.60. Then look at female the temperature is from 88.8 to 84.20 so to me it looks like that if there is a higher temperature then there is a female and a lower temperature for a male. But I only think it is partly true partly false because the temperatures 84 and 85 are both in range for them both.
75925190,10,2,1,"I think it is false. So look at the chart at 1960 the temperature is 84.56 but almost every year after that it has been 85 or 86 but some have been 84 but most are higher on 84. But on 1964,1970 and 1972 are all lower but it said that it has been decreasing since 1960 which means every year after that but way more are higher plus the last year is 85.57 which is also higher."
75925202,1,1,1,I think that it is true because when the temperature is higher there are mostly chrysalis and when it is colder there are more caterpilers.
75925202,1,2,1,I think that it is false because when it is winter all of the butterflys go to  Mexico. So wen they go there every winter the population will go up.
75925202,10,1,1,I think it is true because a lot of the low temperatures are males and high is mostly female.
75925202,10,2,1,I think it is false because the graph shows that it is increasing insted of decreasing.\n
75925203,1,1,1,I think this claim is true because the caterpillars that were in warmer places have already gone to chrysalis stage. where as the other ones are still in caterpillar stage.
75925203,1,2,0,I think this claim is false because there is a lot of variety each year. for example in 2009 there were 96 million butterflies and in 2010 there were 201 million butterflies.
75925203,10,1,1,"I believe that the sand temperature affects whether leatherback eggs hatch as male or female and here's why. because the lower 80s are mostly male the middle temp. 80s are a good mix, and the high 80s are mostly female."
75925203,10,2,0,I think the claim is partly true because the temp. of the sand kind of went up and down.
75925204,1,1,0,If you look at the table you will see that if it is most likely to be warm the turtle will be a female. Because I looked at all of the temperature and the temp is high if it is a female. If the temperature is on the cooler side then that means that the turtle will be a male. All of the temperatures that show males have a lower temperature than the females. And females have a higher temperature than the males. So I think when it is warmer it will be a female and when it is cooler it will be a male.
75925204,1,2,0,If you look closely you will see that the temperature is also  increasing but as the year goes past the temperature is decreasing.It is doing both increasing and decreasing because if you look at the last two temperatures you will see that it will decrease but the very last one is increasing.
75925204,11,1,0,If you look at the table you will see that if it is most likely to be warm the turtle will be a female. Because I looked at all of the temperature and the temp is high if it is a female. If the temperature is on the cooler side then that means that the turtle will be a male. All of the temperatures that show males have a lower temperature than the females. And females have a higher temperature than the males. So I think when it is warmer it will be a female and when it is cooler it will be a male.
75925204,11,2,0,If you look closely you will see that the temperature is also  increasing but as the year goes past the temperature is decreasing.It is doing both increasing and decreasing because if you look at the last two temperatures you will see that it will decrease but the very last one is increasing.
75925205,1,1,1,"i think this claim is true because when the temperature  is warmer most of the butterflies stay inside. When, the temperature is colder most of them stay outside to make there chrysalis."
75925205,1,2,1,i think this claim is false because the data table shows that as years go on the population have been increasing and decressing. Also thats happening because butterflies go there when it gets to cold or to hot where they live and it degreses when they leave to go somewhere else.
75925205,10,1,1,I think it is true because male eggs like the sand cooler then female eggs like the sand .The male eggs like 80 to 85 degrees and female like it 84 to 88 degrees.
75925205,10,2,1,"I made a graph to show whether the tempature has been decreasing or not and the graph showed me that the weather has been increasing. So, it is false the weather has not been decreasing"
75925214,0,1,1,I think the claim is true because in the information I recently got almost all the lowest are outside of the chrysalis and some off the highest are still inside of the chrysalis so my point is that the higher the temperature the longer your in the chrysalis.
75925214,0,2,0,I think claim 2 is false because the population is going up a lot and is almost up to 1000 so i so not think claim 2 is telling the truth.
75925214,11,1,1,I think that claim 1 is true because when the sand gets hot its most likely that a female will hatch. So when it gets colder some of the males will be born so what I am saying is whenever the sand gets hot a female comes out. Whenever the sand is cold and warm a male will come out.
75925214,11,2,0,If you look at the chart the year 1960 is lowest but then it is increasing not decreasing so I think that claim 2 is false.
75925216,0,1,1,"I think this claim is true because, when I organized the data by temperature, I saw some patterns. First, when the eggs were in the 54 - 59.36 degree range, they were all caterpillars. Second, when the eggs were in the 59.37 - 60.90 degree range, they were a mixture of caterpillars and chrysalises. Lastly, when the eggs were in the 60.91 - 64 degree range, they were all chrysalises. That is why I think the claim is true. The temperature of a monarch butterfly's habitat does affect how quickly it goes through its life cycle stages."
75925216,0,2,0,
75925219,1,1,1,I think it's partly true/partly false because from the data outside is kind of warmer then inside and in the higher tempertures the monarchs are already at the chrysalis stage. In the article it said that monarchs move to warmer places in the winter. Places that are not to cold and not to warm. But I also think it is partly false too because looking at the data some monarchs that are inside are in chrysalis.
75925219,1,2,0,I think it's false because in the data It looks like the population for monarch in Mexico is decreaseing. In 1993 the population of monarch in Mexico was 311.50. I think it was increasing and now it is decreasing. The highest year on the data chart is 2017 the population is 124.00 in 2017.
